<?xml version="1.0" encoding="UTF-8"?>

<UIProtocol xmlns:xsi="http://www.w3.org/2001/XMLSchema-instance"
            xsi:noNamespaceSchemaLocation="../schemas/uiprotocol.xml.xsd"
            version="1.0">

    <models>
        <model id="public.application">
            <property name="about" value=""/>
            <property name="attention" value=""/>
            <property name="author" value=""/>
            <property name="avatar" value=""/>
            <property name="category" value=""/>
            <property name="connection" value=""/>
            <property name="cursor" value=""/>
            <property name="description" value=""/>
            <property name="dock.menu" value=""/>
            <property name="dock.message" value=""/>
            <property name="dock.progress" value=""/>
            <property name="dock.tasks" value=""/>
            <property name="global" value=""/>
            <property name="icon" value=""/>
            <property name="menu" value=""/>


            <!--TODO-->

        </model>

    </models>

</UIProtocol>